{
  "schema_version": 1,
  "tool_call_id": "tc_01JBQ2Z8Y3K4M5N6P7Q8R9S0T1",
  "status": "ok",
  "evidence_ids": ["ev_01JBQ2Z8Y3K4M5N6P7Q8R9S0T1"],
  "summary": "1 series, p95 max 950ms at 05:52Z",
  "data": { "truncated": false, "series": 1, "max": 0.95 },
  "usage": { "duration_ms": 120, "bytes": 4096, "rows": 31, "series": 1 }
}
